{
  "product_id": "prd_rear_chamber",
  "as_of": "2026-09-09T09:00:00+01:00",
  "fresh_for_days": 30,
  "supplier_reports": [
    {
      "report_id": "rep_recent_example",
      "supplier_id": "sup_example_1",
      "supplier_name": "Example market contact",
      "product_id": "prd_rear_chamber",
      "availability_status": "reported_available",
      "observed_at": "2026-09-08T10:00:00+01:00",
      "source_capture_id": "cap_example_recent"
    },
    {
      "report_id": "rep_old_example",
      "supplier_id": "sup_example_2",
      "supplier_name": "Older example contact",
      "product_id": "prd_rear_chamber",
      "availability_status": "reported_available",
      "observed_at": "2026-05-01T10:00:00+01:00",
      "source_capture_id": "cap_example_old"
    }
  ]
}
